Tintle,Abstract,Matched Search Term 1,Matched Search Term 2,Matched Search Term 4
" ""Assessing the Efficacy of Clinical Sentiment Analysis and Topic Extraction in Psychiatric Readmission Risk Prediction"","," ""predicting which patients are more likely to be readmitted to a hospital within 30 days after discharge is a valuable piece of information in clinical decision-making. building a successful readmission risk classifier based on the content of electronic health records (ehrs) has proved, however, to be a challenging task. previously explored features include mainly structured information, such as sociodemographic data, comorbidity codes and physiological variables. in this paper we assess incorporating additional clinically interpretable nlp-based features such as topic extraction and clinical sentiment analysis to predict early readmission risk in psychiatry patients."",",electronic health record,nlp,challeng
" ""Towards Understanding of Medical Randomized Controlled Trials by Conclusion Generation"","," ""randomized controlled trials (rcts) represent the paramount evidence of clinical medicine. using machines to interpret the massive amount of rcts has the potential of aiding clinical decision-making. we propose a rct conclusion generation task from the pubmed 200k rct sentence classification dataset to examine the effectiveness of sequence-to-sequence models on understanding rcts. we first build a pointer-generator baseline model for conclusion generation. then we fine-tune the state-of-the-art gpt-2 language model, which is pre-trained with general domain data, for this new medical domain task. both automatic and human evaluation show that our gpt-2 fine-tuned models achieve improved quality and correctness in the generated conclusions compared to the baseline pointer-generator model. further inspection points out the limitations of this current approach and future directions to explore."",",medical domain,generat,evalu
" ""Deep Bidirectional Transformers for Relation Extraction without Supervision"","," ""we present a novel framework to deal with relation extraction tasks in cases where there is complete lack of supervision, either in the form of gold annotations, or relations from a knowledge base. our approach leverages syntactic parsing and pre-trained word embeddings to extract few but precise relations, which are then used to annotate a larger corpus, in a manner identical to distant supervision. the resulting data set is employed to fine tune a pre-trained bert model in order to perform relation extraction. empirical evaluation on four data sets from the biomedical domain shows that our method significantly outperforms two simple baselines for unsupervised relation extraction and, even if not using any supervision at all, achieves slightly worse results than the state-of-the-art in three out of four data sets. importantly, we show that it is possible to successfully fine tune a large pretrained language model with noisy data, as opposed to previous works that rely on gold data for fine tuning."",",medical domain,relation extract,annotat
" ""{P}harma{C}o{NER}: Pharmacological Substances, Compounds and proteins Named Entity Recognition track"","," ""one of the biomedical entity types of relevance for medicine or biosciences are chemical compounds and drugs. the correct detection these entities is critical for other text mining applications building on them, such as adverse drug-reaction detection, medication-related fake news or drug-target extraction. although a significant effort was made to detect mentions of drugs/chemicals in english texts, so far only very limited attempts were made to recognize them in medical documents in other languages. taking into account the growing amount of medical publications and clinical records written in spanish, we have organized the first shared task on detecting drug and chemical entities in spanish medical documents. additionally, we included a clinical concept-indexing sub-track asking teams to return snomed-ct identifiers related to drugs/chemicals for a collection of documents. for this task, named pharmaconer, we generated annotation guidelines together with a corpus of 1,000 manually annotated clinical case studies. a total of 22 teams participated in the sub-track 1, (77 system runs), and 7 teams in the sub-track 2 (19 system runs). top scoring teams used sophisticated deep learning approaches yielding very competitive results with f-measures above 0.91. these results indicate that there is a real interest in promoting biomedical text mining efforts beyond english. we foresee that the pharmaconer annotation guidelines, corpus and participant systems will foster the development of new resources for clinical and biomedical text mining systems of spanish medical data."",",clinical record,generat,shared task
" ""A Deep Learning-Based System for {P}harma{C}o{NER}"","," ""the biological text mining unit at bsc and cnio organized the first shared task on chemical {\&} drug mention recognition from spanish medical texts called pharmaconer (pharmacological substances, compounds and proteins and named entity recognition track) in 2019, which includes two tracks: one for ner offset and entity classification (track 1) and the other one for concept indexing (track 2). we developed a pipeline system based on deep learning methods for this shared task, specifically, a subsystem based on bert (bidirectional encoder representations from transformers) for ner offset and entity classification and a subsystem based on bpool (bi-lstm with max/mean pooling) for concept indexing. evaluation conducted on the shared task data showed that our system achieves a micro-average f1-score of 0.9105 on track 1 and a micro-average f1-score of 0.8391 on track 2."",",medical text,entity recognit,shared task
" ""Transfer Learning in Biomedical Named Entity Recognition: An Evaluation of {BERT} in the {P}harma{C}o{NER} task"","," ""to date, a large amount of biomedical content has been published in non-english texts, especially for clinical documents. therefore, it is of considerable significance to conduct natural language processing (nlp) research in non-english literature. pharmaconer is the first named entity recognition (ner) task to recognize chemical and protein entities from spanish biomedical texts. since there have been abundant resources in the nlp field, how to exploit these existing resources to a new task to obtain competitive performance is a meaningful study. inspired by the success of transfer learning with language models, we introduce the bert benchmark to facilitate the research of pharmaconer task. in this paper, we evaluate two baselines based on multilingual bert and biobert on the pharmaconer corpus. experimental results show that transferring the knowledge learned from source large-scale datasets to the target domain offers an effective solution for the pharmaconer task."",",medical text,natural language process,benchmark
" ""Using Snomed to recognize and index chemical and drug mentions."","," ""in this paper we describe a new named entity extraction system. our work proposes a system for the identification and annotation of drug names in spanish biomedical texts based on machine learning and deep learning models. subsequently, a standardized code using snomed is assigned to these drugs, for this purpose, natural language processing tools and techniques have been used, and a dictionary of different sources of information has been built. the results are promising, we obtain 78{\%} in f1 score on the first sub-track and in the second task we map with snomed correctly 72{\%} of the found entities."",",medical text,natural language process,annotat
" ""{BOUN}-{ISIK} Participation: An Unsupervised Approach for the Named Entity Normalization and Relation Extraction of Bacteria Biotopes"","," ""this paper presents our participation to the bacteria biotope task of the bionlp shared task 2019. our participation includes two systems for the two subtasks of the bacteria biotope task: the normalization of entities (bb-norm) and the identification of the relations between the entities given a biomedical text (bb-rel). for the normalization of entities, we utilized word embeddings and syntactic re-ranking. for the relation extraction task, pre-defined rules are used. although both approaches are unsupervised, in the sense that they do not need any labeled data, they achieved promising results. especially, for the bb-norm task, the results have shown that the proposed method performs as good as deep learning based methods, which require labeled data."",",medical text,nlp,shared task
" ""{CRAFT} Shared Tasks 2019 Overview {---} Integrated Structure, Semantics, and Coreference"","," ""as part of the bionlp open shared tasks 2019, the craft shared tasks 2019 provides a platform to gauge the state of the art for three fundamental language processing tasks {---} dependency parse construction, coreference resolution, and ontology concept identification {---} over full-text biomedical articles. the structural annotation task requires the automatic generation of dependency parses for each sentence of an article given only the article text. the coreference resolution task focuses on linking coreferring base noun phrase mentions into chains using the symmetrical and transitive identity relation. the ontology concept annotation task involves the identification of concept mentions within text using the classes of ten distinct ontologies in the biomedical domain, both unmodified and augmented with extension classes. this paper provides an overview of each task, including descriptions of the data provided to participants and the evaluation metrics used, and discusses participant results relative to baseline performances for each of the three tasks."",",medical domain,language process,shared task
" ""Neural Dependency Parsing of Biomedical Text: {T}urku{NLP} entry in the {CRAFT} Structural Annotation Task"","," ""we present the approach taken by the turkunlp group in the craft structural annotation task, a shared task on dependency parsing. our approach builds primarily on the turku neural parser, a native dependency parser that ranked among the best in the recent conll tasks on parsing universal dependencies. to adapt the parser to the biomedical domain, we considered and evaluated a number of approaches, including the generation of custom word embeddings, combination with other in-domain resources, and the incorporation of information from named entity recognition. we achieved a labeled attachment score of 89.7{\%}, the best result among task participants."",",medical domain,nlp,shared task
" ""{RD}o{C} Task at {B}io{NLP}-{OST} 2019"","," ""bionlp open shared tasks (bionlp-ost) is an international competition organized to facilitate development and sharing of computational tasks of biomedical text mining and solutions to them. for bionlp-ost 2019, we introduced a new mental health informatics task called {``}rdoc task{''}, which is composed of two subtasks: information retrieval and sentence extraction through national institutes of mental health{'}s research domain criteria framework. five and four teams around the world participated in the two tasks, respectively. according to the performance on the two tasks, we observe that there is room for improvement for text mining on brain research and mental illness."",",medical text,nlp,shared task
" ""Leveraging Dependency Forest for Neural Medical Relation Extraction"","," ""medical relation extraction discovers relations between entity mentions in text, such as research articles. for this task, dependency syntax has been recognized as a crucial source of features. yet in the medical domain, 1-best parse trees suffer from relatively low accuracies, diminishing their usefulness. we investigate a method to alleviate this problem by utilizing dependency forests. forests contain more than one possible decisions and therefore have higher recall but more noise compared with 1-best outputs. a graph neural network is used to represent the forests, automatically distinguishing the useful syntactic information from parsing noise. results on two benchmarks show that our method outperforms the standard tree-based methods, giving the state-of-the-art results in the literature."",",medical domain,relation extract,benchmark
" ""Leveraging Medical Literature for Section Prediction in Electronic Health Records"","," ""electronic health records (ehrs) contain both structured content and unstructured (text) content about a patient{'}s medical history. in the unstructured text parts, there are common sections such as assessment and plan, social history, and medications. these sections help physicians find information easily and can be used by an information retrieval system to return specific information sought by a user. however, it is common that the exact format of sections in a particular ehr does not adhere to known patterns. therefore, being able to predict sections and headers in ehrs automatically is beneficial to physicians. prior approaches in ehr section prediction have only used text data from ehrs and have required significant manual annotation. we propose using sections from medical literature (e.g., textbooks, journals, web content) that contain content similar to that found in ehr sections. our approach uses data from a different kind of source where labels are provided without the need of a time-consuming annotation effort. we use this data to train two models: an rnn and a bert-based model. we apply the learned models along with source data via transfer learning to predict sections in ehrs. our results show that medical literature can provide helpful supervision signal for this classification task."",",electronic health record,information retriev,annotat
" ""Enhancing Dialogue Symptom Diagnosis with Global Attention and Symptom Graph"","," ""symptom diagnosis is a challenging yet profound problem in natural language processing. most previous research focus on investigating the standard electronic medical records for symptom diagnosis, while the dialogues between doctors and patients that contain more rich information are not well studied. in this paper, we first construct a dialogue symptom diagnosis dataset based on an online medical forum with a large amount of dialogues between patients and doctors. then, we provide some benchmark models on this dataset to boost the research of dialogue symptom diagnosis. in order to further enhance the performance of symptom diagnosis over dialogues, we propose a global attention mechanism to capture more symptom related information, and build a symptom graph to model the associations between symptoms rather than treating each symptom independently. experimental results show that both the global attention and symptom graph are effective to boost dialogue symptom diagnosis. in particular, our proposed model achieves the state-of-the-art performance on the constructed dataset."",",medical record,natural language process,challeng
" ""{DRC}o{V}e: An Augmented Word Representation Approach using Distributional and Relational Context"","," ""word representation using the distributional information of words from a sizeable corpus is considered efficacious in many natural language processing and text mining applications. however, distributional representation of a word is unable to capture distant relational knowledge, representing the relational semantics. in this paper, we propose a novel word representation approach using distributional and relational contexts, drcove, which augments the distributional representation of a word using the relational semantics extracted as syntactic and semantic association among entities from the underlying corpus. unlike existing approaches that use external knowledge bases representing the relational semantics for enhanced word representation, drcove uses typed dependencies (aka syntactic dependencies) to extract relational knowledge from the underlying corpus. the proposed approach is applied over a biomedical text corpus to learn word representation and compared with glove, which is one of the most popular word embedding approaches. the evaluation results on various benchmark datasets for word similarity and word categorization tasks demonstrate the effectiveness of drcove over the glove."",",medical text,natural language process,benchmark
" ""Findings of the {WMT} 2018 Biomedical Translation Shared Task: Evaluation on {M}edline test sets"","," ""machine translation enables the automatic translation of textual documents between languages and can facilitate access to information only available in a given language for non-speakers of this language, e.g. research results presented in scientific publications. in this paper, we provide an overview of the biomedical translation shared task in the workshop on machine translation (wmt) 2018, which specifically examined the performance of machine translation systems for biomedical texts. this year, we provided test sets of scientific publications from two sources (edp and medline) and for six language pairs (english with each of chinese, french, german, portuguese, romanian and spanish). we describe the development of the various test sets, the submissions that we received and the evaluations that we carried out. we obtained a total of 39 runs from six teams and some of this year{'}s bleu scores were somewhat higher that last year{'}s, especially for teams that made use of biomedical resources or state-of-the-art mt algorithms (e.g. transformer). finally, our manual evaluation scored automatic translations higher than the reference translations for german and spanish."",",medical text,translat,shared task
" ""Translation of Biomedical Documents with Focus on {S}panish-{E}nglish"","," ""for the wmt 2018 shared task of translating documents pertaining to the biomedical domain, we developed a scoring formula that uses an unsophisticated and effective method of weighting term frequencies and was integrated in a data selection pipeline. the method was applied on five language pairs and it performed best on portuguese-english, where a bleu score of 41.84 placed it third out of seven runs submitted by three institutions. in this paper, we describe our method and results with a special focus on spanish-english where we compare it against a state-of-the-art method. our contribution to the task lies in introducing a fast, unsupervised method for selecting domain-specific data for training models which obtain good results using only 10{\%} of the general domain data."",",medical domain,translat,shared task
" ""{LMU} {M}unich{'}s Neural Machine Translation Systems at {WMT} 2018"","," ""we present the lmu munich machine translation systems for the english{--}german language pair. we have built neural machine translation systems for both translation directions (englishgerman and germanenglish) and for two different domains (the biomedical domain and the news domain). the systems were used for our participation in the wmt18 biomedical translation task and in the shared task on machine translation of news. the main focus of our recent system development efforts has been on achieving improvements in the biomedical domain over last year{'}s strong biomedical translation engine for englishgerman (huck et al., 2017a). considerable progress has been made in the latter task, which we report on in this paper."",",medical domain,translat,shared task
" ""Investigating the Challenges of Temporal Relation Extraction from Clinical Text"","," ""temporal reasoning remains as an unsolved task for natural language processing (nlp), particularly demonstrated in the clinical domain. the complexity of temporal representation in language is evident as results of the 2016 clinical tempeval challenge indicate: the current state-of-the-art systems perform well in solving mention-identification tasks of event and time expressions but poorly in temporal relation extraction, showing a gap of around 0.25 point below human performance. we explore to adapt the tree-based lstm-rnn model proposed by miwa and bansal (2016) to temporal relation extraction from clinical text, obtaining a five point improvement over the best 2016 clinical tempeval system and two points over the state-of-the-art. we deliver a deep analysis of the results and discuss the next step towards human-like temporal reasoning."",",clinical domain,natural language process,challeng
" ""Syntax-based Transfer Learning for the Task of Biomedical Relation Extraction"","," ""transfer learning (tl) proposes to enhance machine learning performance on a problem, by reusing labeled data originally designed for a related problem. in particular, domain adaptation consists, for a specific task, in reusing training data developed for the same task but a distinct domain. this is particularly relevant to the applications of deep learning in natural language processing, because those usually require large annotated corpora that may not exist for the targeted domain, but exist for side domains. in this paper, we experiment with tl for the task of relation extraction (re) from biomedical texts, using the treelstm model. we empirically show the impact of treelstm alone and with domain adaptation by obtaining better performances than the state of the art on two biomedical re tasks and equal performances for two others, for which few annotated data are available. furthermore, we propose an analysis of the role that syntactic features may play in tl for re."",",medical text,natural language process,annotat
" ""In-domain Context-aware Token Embeddings Improve Biomedical Named Entity Recognition"","," ""rapidly expanding volume of publications in the biomedical domain makes it increasingly difficult for a timely evaluation of the latest literature. that, along with a push for automated evaluation of clinical reports, present opportunities for effective natural language processing methods. in this study we target the problem of named entity recognition, where texts are processed to annotate terms that are relevant for biomedical studies. terms of interest in the domain include gene and protein names, and cell lines and types. here we report on a pipeline built on embeddings from language models (elmo) and a deep learning package for natural language processing (allennlp). we trained context-aware token embeddings on a dataset of biomedical papers using elmo, and incorporated these embeddings in the lstm-crf model used by allennlp for named entity recognition. we show these representations improve named entity recognition for different types of biomedical named entities. we also achieve a new state of the art in gene mention detection on the biocreative ii gene mention shared task."",",medical domain,natural language process,shared task
" ""Time Expressions in Mental Health Records for Symptom Onset Extraction"","," ""for psychiatric disorders such as schizophrenia, longer durations of untreated psychosis are associated with worse intervention outcomes. data included in electronic health records (ehrs) can be useful for retrospective clinical studies, but much of this is stored as unstructured text which cannot be directly used in computation. natural language processing (nlp) methods can be used to extract this data, in order to identify symptoms and treatments from mental health records, and temporally anchor the first emergence of these. we are developing an ehr corpus annotated with time expressions, clinical entities and their relations, to be used for nlp development. in this study, we focus on the first step, identifying time expressions in ehrs for patients with schizophrenia. we developed a gold standard corpus, compared this corpus to other related corpora in terms of content and time expression prevalence, and adapted two nlp systems for extracting time expressions. to the best of our knowledge, this is the first resource annotated for temporal entities in the mental health domain."",",electronic health record,natural language process,annotat
" ""Evaluation of a Sequence Tagging Tool for Biomedical Texts"","," ""many applications in biomedical natural language processing rely on sequence tagging as an initial step to perform more complex analysis. to support text analysis in the biomedical domain, we introduce yet another sequence tagger (yaset), an open-source multi purpose sequence tagger that implements state-of-the-art deep learning algorithms for sequence tagging. herein, we evaluate yaset on part-of-speech tagging and named entity recognition in a variety of text genres including articles from the biomedical literature in english and clinical narratives in french. to further characterize performance, we report distributions over 30 runs and different sizes of training datasets. yaset provides state-of-the-art performance on the conll 2003 ner dataset (f1",clinical narr,natural language process,evalu
