Tintle,Abstract,Matched Search Term 1,Matched Search Term 2,Matched Search Term 4
" ""Divide and Conquer: An Extreme Multi-Label Classification Approach for Coding Diseases and Procedures in {S}panish"","," ""clinical coding is the task of transforming medical documents into structured codes following a standard ontology. since these terminologies are composed of hundreds of codes, this problem can be considered an extreme multi-label classification task. this paper proposes a novel neural network-based architecture for clinical coding. first, we take full advantage of the hierarchical nature of ontologies to create clusters based on semantic relations. then, we use a matcher module to assign the probability of documents belonging to each cluster. finally, the ranker calculates the probability of each code considering only the documents in the cluster. this division allows a fine-grained differentiation within the cluster, which cannot be addressed using a single classifier. in addition, since most of the previous work has focused on solving this task in english, we conducted our experiments on three clinical coding corpora in spanish. the experimental results demonstrate the effectiveness of our model, achieving state-of-the-art results on two of the three datasets. specifically, we outperformed previous models on two subtasks of the codiesp shared task: codiesp-d (diseases) and codiesp-p (procedures). automatic coding can profoundly impact healthcare by structuring critical information written in free text in electronic health records."",",electronic health record,semant,shared task
" ""A Knowledge-Graph-Based Intrinsic Test for Benchmarking Medical Concept Embeddings and Pretrained Language Models"","," ""using language models created from large data sources has improved the performance of several deep learning-based architectures, obtaining state-of-the-art results in several nlp extrinsic tasks. however, little research is related to creating intrinsic tests that allow us to compare the quality of different language models when obtaining contextualized embeddings. this gap increases even more when working on specific domains in languages other than english. this paper proposes a novel graph-based intrinsic test that allows us to measure the quality of different language models in clinical and biomedical domains in spanish. our results show that our intrinsic test performs better for clinical and biomedical language models than a general one. also, it correlates with better outcomes for a ner task using a probing model over contextualized embeddings. we hope our work will help the clinical nlp research community to evaluate and compare new language models in other languages and find the most suitable models for solving downstream tasks."",",medical domain,nlp,evalu
" ""Augmented Bio-{SBERT}: Improving Performance for Pairwise Sentence Tasks in Bio-medical Domain"","," ""one of the modern challenges in ai is the access to high-quality and annotated data, especially in nlp; that is why augmentation is gaining importance. in computer vision, where image data augmentation is standard, text data augmentation in nlp is complex due to the high complexity of language. moreover, we have seen the advantages of augmentation where there are fewer data available, which can significantly improve the model{'}s accuracy and performance. we have implemented augmentation in pairwise sentence scoring in the biomedical domain. by experimenting with our approach to downstream tasks on biomedical data, we have looked into the solution to improve bi-encoders{'} sentence transformer performance using an augmented dataset generated by cross-encoders fine-tuned on biosses and mednli on the pre-trained bio-bert model. it has significantly improved the results with respect to the model only trained on gold data for the respective tasks."",",medical domain,nlp,annotat
" ""Cross-Clinic De-Identification of {S}wedish Electronic Health Records: Nuances and Caveats"","," ""privacy preservation of sensitive information is one of the main concerns in clinical text mining. due to the inherent privacy risks of handling clinical data, the clinical corpora used to create the clinical named entity recognition (ner) models underlying clinical de-identification systems cannot be shared. this situation implies that clinical ner models are trained and tested on data originating from the same institution since it is rarely possible to evaluate them on data belonging to a different organization. these restrictions on sharing make it very difficult to assess whether a clinical ner model has overfitted the data or if it has learned any undetected biases. this paper presents the results of the first-ever cross-institution evaluation of a swedish de-identification system on swedish clinical data. alongside the encouraging results, we discuss differences and similarities across ehr naming conventions and ner tagsets."",",clinical text,entity recognit,evalu
" ""Efficient Joint Learning for Clinical Named Entity Recognition and Relation Extraction Using {F}ourier Networks:A Use Case in Adverse Drug Events"","," ""current approaches for clinical information extraction are inefficient in terms of computational costs and memory consumption, hindering their application to process large-scale electronic health records (ehrs). we propose an efficient end-to-end model, the joint-ner-re-fourier (jnrf), to jointly learn the tasks of named entity recognition and relation extraction for documents of variable length. the architecture uses positional encoding and unitary batch sizes to process variable length documents and uses a weight-shared fourier network layer for low-complexity token mixing. finally, we reach the theoretical computational complexity lower bound for relation extraction using a selective pooling strategy and distance-aware attention weights with trainable polynomial distance functions. we evaluated the jnrf architecture using the 2018 n2c2 ade benchmark to jointly extract medication-related entities and relations in variable-length ehr summaries. jnrf outperforms rolling window bert with selective pooling by 0.42{\%}, while being twice as fast to train. compared to state-of-the-art bilstm-crf architectures on the n2c2 ade benchmark, results show that the proposed approach trains 22 times faster and reduces gpu memory consumption by 1.75 folds, with a reasonable performance tradeoff of 90{\%}, without the use of external tools, hand-crafted rules or post-processing. given the significant carbon footprint of deep learning models and the current energy crises, these methods could support efficient and cleaner information extraction in ehrs and other types of large-scale document databases."",",electronic health record,relation extract,benchmark
" ""Knowledge-Rich Self-Supervision for Biomedical Entity Linking"","," ""entity linking faces significant challenges such as prolific variations and prevalent ambiguities, especially in high-value domains with myriad entities. standard classification approaches suffer from the annotation bottleneck and cannot effectively handle unseen entities. zero-shot entity linking has emerged as a promising direction for generalizing to new entities, but it still requires example gold entity mentions during training and canonical descriptions for all entities, both of which are rarely available outside of wikipedia. in this paper, we explore knowledge-rich self-supervision (kriss) for biomedical entity linking, by leveraging readily available domain knowledge. in training, it generates self-supervised mention examples on unlabeled text using a domain ontology and trains a contextual encoder using contrastive learning. for inference, it samples self-supervised mentions as prototypes for each entity and conducts linking by mapping the test mention to the most similar prototype. our approach can easily incorporate entity descriptions and gold mention labels if available. we conducted extensive experiments on seven standard datasets spanning biomedical literature and clinical notes. without using any labeled information, our method produces krissbert, a universal entity linker for four million umls entities that attains new state of the art, outperforming prior self-supervised methods by as much as 20 absolute points in accuracy. we released krissbert at \url{https://aka.ms/krissbert}."",",clinical not,infer,annotat
" ""Knowledge Injected Prompt Based Fine-tuning for Multi-label Few-shot {ICD} Coding"","," ""automatic international classification of diseases (icd) coding aims to assign multiple icd codes to a medical note with average length of 3,000+ tokens. this task is challenging due to a high-dimensional space of multi-label assignment (tens of thousands of icd codes) and the long-tail challenge: only a few codes (common diseases) are frequently assigned while most codes (rare diseases) are infrequently assigned. this study addresses the long-tail challenge by adapting a prompt-based fine-tuning technique with label semantics, which has been shown to be effective under few-shot setting. to further enhance the performance in medical domain, we propose a knowledge-enhanced longformer by injecting three domain-specific knowledge: hierarchy, synonym, and abbreviation with additional pretraining using contrastive learning. experiments on mimic-iii-full, a benchmark dataset of code assignment, show that our proposed method outperforms previous state-of-the-art method in 14.5{\%} in marco f1 (from 10.3 to 11.8, p{\textless}0.001). to further test our model on few-shot setting, we created a new rare diseases coding dataset, mimic-iii-rare50, on which our model improves marco f1 from 17.1 to 30.4 and micro f1 from 17.2 to 32.6 compared to previous method."",",medical domain,semant,challeng
" ""P$\text{M}^2\text{F}^2${N}: Patient Multi-view Multi-modal Feature Fusion Networks for Clinical Outcome Prediction"","," ""clinical outcome prediction is critical to the condition prediction of patients and management of hospital capacities. there are two kinds of medical data, including time series signals recorded by various devices and clinical notes in electronic health records (ehr), which are used for two common prediction targets: mortality and length of stay. traditional methods focused on utilizing time series data but ignored clinical notes. with the development of deep learning, natural language processing (nlp) and multi-modal learning methods are exploited to jointly model the time series and clinical notes with different modals. however, the existing methods failed to fuse the multi-modal features of patients from different views. therefore, we propose the patient multi-view multi-modal feature fusion networks for clinical outcome prediction. firstly, from patient inner view, we propose to utilize the co-attention module to enhance the fine-grained feature interaction between time series and clinical notes from each patient. secondly, the patient outer view is the correlation between patients, which can be reflected by the structural knowledge in clinical notes. we exploit the structural information extracted from clinical notes to construct the patient correlation graph, and fuse patients{'} multi-modal features by graph neural networks (gnn). the experimental results on mimic-iii benchmark demonstrate the superiority of our method."",",electronic health record,natural language process,benchmark
" ""{M}3: Multi-level dataset for Multi-document summarisation of Medical studies"","," ""we present m3 (multi-level dataset for multi-document summarisation of medical studies), a benchmark dataset for evaluating the quality of summarisation systems in the biomedical domain. the dataset contains sets of multiple input documents and target summaries of three levels of complexity: documents, sentences, and propositions. the dataset also includes several levels of annotation, including biomedical entities, direction, and strength of relations between them, and the discourse relationships between the input documents ({``}contradiction{''} or {``}agreement{''}). we showcase usage scenarios of the dataset by testing 10 generic and domain-specific summarisation models in a zero-shot setting, and introduce a probing task based on counterfactuals to test if models are aware of the direction and strength of the conclusions generated from input studies."",",medical domain,generat,annotat
" ""Learning to Revise References for Faithful Summarization"","," ""in real-world scenarios with naturally occurring datasets, reference summaries are noisy and may contain information that cannot be inferred from the source text. on large news corpora, removing low quality samples has been shown to reduce model hallucinations. yet, for smaller, and/or noisier corpora, filtering is detrimental to performance. to improve reference quality while retaining all data, we propose a new approach: to selectively re-write unsupported reference sentences to better reflect source data. we automatically generate a synthetic dataset of positive and negative revisions by corrupting supported sentences and learn to revise reference sentences with contrastive learning. the intensity of revisions is treated as a controllable attribute so that, at inference, diverse candidates can be over-generated-then-rescored to balance faithfulness and abstraction. to test our methods, we extract noisy references from publicly available mimic-iii discharge summaries for the task of hospital-course summarization, and vary the data on which models are trained. according to metrics and human evaluation, models trained on revised clinical references are much more faithful, informative, and fluent than models trained on original or filtered data."",",discharge summar,infer,evalu
" ""Readability Controllable Biomedical Document Summarization"","," ""different from general documents, it is recognised that the ease with which people can understand a biomedical text is eminently varied, owing to the highly technical nature of biomedical documents and the variance of readers{'} domain knowledge. however, existing biomedical document summarization systems have paid little attention to readability control, leaving users with summaries that are incompatible with their levels of expertise. in recognition of this urgent demand, we introduce a new task of readability controllable summarization for biomedical documents, which aims to recognise users{'} readability demands and generate summaries that better suit their needs: technical summaries for experts and plain language summaries (pls) for laymen. to establish this task, we construct a corpus consisting of biomedical papers with technical summaries and plss written by the authors, and benchmark multiple advanced controllable abstractive and extractive summarization models based on pre-trained language models (plms) with prevalent controlling and generation techniques. moreover, we propose a novel masked language model (mlm) based metric and its variant to effectively evaluate the readability discrepancy between lay and technical summaries. experimental results from automated and human evaluations show that though current control techniques allow for a certain degree of readability adjustment during generation, the performance of existing controllable summarization methods is far from desirable in this task."",",medical text,generat,benchmark
" ""{B}io{NLI}: Generating a Biomedical {NLI} Dataset Using Lexico-semantic Constraints for Adversarial Examples"","," ""natural language inference (nli) is critical in many domains requiring complex decision-making, such as the biomedical domain. we introduce a novel semi-supervised procedure that bootstraps biomedical nli datasets from positive entailment examples present in abstracts of biomedical publications. we focus on challenging texts where the hypothesis includes mechanistic information such as biochemical interactions between two entities. a key contribution of this work is automating the creation of negative examples that are informative without being simplistic. we generate a range of negative examples using nine strategies that manipulate the structure of the underlying mechanisms both with rules, e.g., flip the roles of the entities in the interaction, and, more importantly, by imposing the perturbed conditions as logical constraints in a neuro-logical decoding system (citation).we use this procedure to create a novel dataset for nli in the biomedical domain, called . the accuracy of neural classifiers on this dataset is in the mid 70s f1, which indicates that this nli task remains to be solved. critically, we observe that the performance on the different classes of negative examples varies widely, from 97{\%} f1 on the simple negative examples that change the role of the entities in the hypothesis, to barely better than chance on the negative examples generated using neuro-logic decoding."",",medical domain,natural languag,challeng
" ""{C}linical{T}5: A Generative Language Model for Clinical Text"","," ""in the past few years, large pre-trained language models (plms) have been widely adopted in different areas and have made fundamental improvements over a variety of downstream tasks in natural language processing (nlp). meanwhile, domain-specific variants of plms are being proposed to address the needs of domains that demonstrate a specific pattern of writing and vocabulary, e.g., biobert for the biomedical domain and clinicalbert for the clinical domain. recently, generative language models like bart and t5 are gaining popularity with their competitive performance on text generation as well as on tasks cast as generative problems. however, in the clinical domain, such domain-specific generative variants are still underexplored. to address this need, our work introduces a t5-based text-to-text transformer model pre-trained on clinical text, i.e., clinicalt5. we evaluate the proposed model both intrinsically and extrinsically over a diverse set of tasks across multiple datasets, and show that clinicalt5 dramatically outperforms t5 in the domain-specific tasks and compares favorably with its close baselines."",",clinical domain,natural language process,evalu
" ""Detection, Disambiguation, Re-ranking: Autoregressive Entity Linking as a Multi-Task Problem"","," ""we propose an autoregressive entity linking model, that is trained with two auxiliary tasks, and learns to re-rank generated samples at inference time. our proposed novelties address two weaknesses in the literature. first, a recent method proposes to learn mention detection and then entity candidate selection, but relies on predefined sets of candidates. we use encoder-decoder autoregressive entity linking in order to bypass this need, and propose to train mention detection as an auxiliary task instead. second, previous work suggests that re-ranking could help correct prediction errors. we add a new, auxiliary task, match prediction, to learn re-ranking. without the use of a knowledge base or candidate sets, our model sets a new state of the art in two benchmark datasets of entity linking: cometa in the biomedical domain, and aida-conll in the news domain. we show through ablation studies that each of the two auxiliary tasks increases performance, and that re-ranking is an important factor to the increase. finally, our low-resource experimental results suggest that performance on the main task benefits from the knowledge learned by the auxiliary tasks, and not just from the additional training data."",",medical domain,infer,benchmark
" ""Large language models are few-shot clinical information extractors"","," ""a long-running goal of the clinical nlp community is the extraction of important variables trapped in clinical notes. however, roadblocks have included dataset shift from the general domain and a lack of public clinical corpora and annotations. in this work, we show that large language models, such as instructgpt (ouyang et al., 2022), perform well at zero- and few-shot information extraction from clinical text despite not being trained specifically for the clinical domain. whereas text classification and generation performance have already been studied extensively in such models, here we additionally demonstrate how to leverage them to tackle a diverse set of nlp tasks which require more structured outputs, including span identification, token-level sequence classification, and relation extraction. further, due to the dearth of available data to evaluate these systems, we introduce new datasets for benchmarking few-shot clinical information extraction based on a manual re-annotation of the casi dataset (moon et al., 2014) for new tasks. on the clinical extraction tasks we studied, the gpt-3 systems significantly outperform existing zero- and few-shot baselines."",",clinical domain,nlp,annotat
" ""A Speaker-Aware Co-Attention Framework for Medical Dialogue Information Extraction"","," ""with the development of medical digitization, the extraction and structuring of electronic medical records (emrs) have become challenging but fundamental tasks. how to accurately and automatically extract structured information from medical dialogues is especially difficult because the information needs to be inferred from complex interactions between the doctor and the patient. to this end, in this paper, we propose a speaker-aware co-attention framework for medical dialogue information extraction. to better utilize the pre-trained language representation model to perceive the semantics of the utterance and the candidate item, we develop a speaker-aware dialogue encoder with multi-task learning, which considers the speaker{'}s identity into account. to deal with complex interactions between different utterances and the correlations between utterances and candidate items, we propose a co-attention fusion network to aggregate the utterance information. we evaluate our framework on the public medical dialogue extraction datasets to demonstrate the superiority of our method, which can outperform the state-of-the-art methods by a large margin. codes will be publicly available upon acceptance."",",medical record,infer,challeng
" ""{M}ed{JE}x: A Medical Jargon Extraction Model with {W}iki{'}s Hyperlink Span and Contextualized Masked Language Model Score"","," ""this paper proposes a new natural language processing (nlp) application for identifying medical jargon terms potentially difficult for patients to comprehend from electronic health record (ehr) notes. we first present a novel and publicly available dataset with expert-annotated medical jargon terms from 18k+ ehr note sentences (medj). then, we introduce a novel medical jargon extraction (medjex) model which has been shown to outperform existing state-of-the-art nlp models. first, medjex improved the overall performance when it was trained on an auxiliary wikipedia hyperlink span dataset, where hyperlink spans provide additional wikipedia articles to explain the spans (or terms), and then fine-tuned on the annotated medj data. secondly, we found that a contextualized masked language model score was beneficial for detecting domain-specific unfamiliar jargon terms. moreover, our results show that training on the auxiliary wikipedia hyperlink span datasets improved six out of eight biomedical named entity recognition benchmark datasets. medjex is publicly available."",",electronic health record,natural language process,annotat
" ""{A}n{EMIC}: A Framework for Benchmarking {ICD} Coding Models"","," ""diagnostic coding, or icd coding, is the task of assigning diagnosis codes defined by the icd (international classification of diseases) standard to patient visits based on clinical notes. the current process of manual icd coding is time-consuming and often error-prone, which suggests the need for automatic icd coding. however, despite the long history of automatic icd coding, there have been no standardized frameworks for benchmarking icd coding models. we open-source an easy-to-use tool named \textit{anemic}, which provides a streamlined pipeline for preprocessing, training, and evaluating for automatic icd coding. we correct errors in preprocessing by existing works, and provide key models and weights trained on the correctly preprocessed datasets. we also provide an interactive demo performing real-time inference from custom inputs, and visualizations drawn from explainable ai to analyze the models. we hope the framework helps move the research of icd coding forward and helps professionals explore the potential of icd coding. the framework and the associated code are available here."",",clinical not,infer,benchmark
