Tintle,Abstract,Matched Search Term 1,Matched Search Term 2,Matched Search Term 4
" ""Discourse Mode Categorization of {B}engali Social Media Health Text"","," ""the scarcity of annotated data is a major impediment to natural language processing (nlp) research in bengali, a language that is considered low-resource. in particular, the health and medical domains suffer from a severe paucity of annotated data. thus, this study aims to introduce banglasocialhealth, an annotated social media health corpus that provides sentence-level annotations of four distinct types of expression modes, namely narrative (nar), informative (inf), suggestive (sug), and inquiring (inq) modes in bengali. we provide details regarding the annotation procedures and report various statistics, such as the median and mean length of words in different sentence modes. additionally, we apply classical machine learning (cml) classifiers and transformer-based language models to classify sentence modes. we find that most of the statistical properties are similar in different types of sentence modes. to determine the sentence mode, the transformer-based m-bert model provides slightly better efficacy than the cml classifiers. our developed corpus and analysis represent a much-needed contribution to bengali nlp research in medical and health domains and have the potential to facilitate a range of downstream tasks, including question-answering, misinformation detection, and information retrieval."",",medical domain,natural language process,annotat
" ""{YNU}-{HPCC} at {S}em{E}val-2023 Task7: Multi-evidence Natural Language Inference for Clinical Trial Data Based a {B}io{BERT} Model"","," ""this paper describes the system for the ynu-hpcc team in subtask 1 of the semeval-2023 task 7: multi-evidence natural language inference for clinical trial data (nli4ct). this task requires judging the textual entailment relationship between the given ctr and the statement annotated by the expert annotator. this system is based on the fine-tuned bi-directional encoder representation from transformers for biomedical text mining (biobert) model with supervised contrastive learning and back translation. supervised contrastive learning is to enhance the classification, and back translation is to enhance the training data. our system achieved relatively good results on the competition{'}s official leaderboard. the code of this paper is available at \url{https://github.com/facanhe/semeval-2023-task7}."",",medical text,natural languag,annotat
" ""Using Membership Inference Attacks to Evaluate Privacy-Preserving Language Modeling Fails for Pseudonymizing Data"","," ""large pre-trained language models dominate the current state-of-the-art for many natural language processing applications, including the field of clinical nlp. several studies have found that these can be susceptible to privacy attacks that are unacceptable in the clinical domain where personally identifiable information (pii) must not be exposed. however, there is no consensus regarding how to quantify the privacy risks of different models. one prominent suggestion is to quantify these risks using membership inference attacks. in this study, we show that a state-of-the-art membership inference attack on a clinical bert model fails to detect the privacy benefits from pseudonymizing data. this suggests that such attacks may be inadequate for evaluating token-level privacy preservation of piis."",",clinical domain,natural language process,evalu
" ""{D}anish Clinical Named Entity Recognition and Relation Extraction"","," ""electronic health records contain important information regarding the patients{'} medical history but much of this information is stored in unstructured narrative text. this paper presents the first danish clinical named entity recognition and relation extraction dataset for extraction of six types of clinical events, six types of attributes, and three types of relations. the dataset contains 11,607 paragraphs from danish electronic health records containing 54,631 clinical events, 41,954 attributes, and 14,604 relations. we detail the methodology of developing the annotation scheme, and train a transformer-based architecture on the developed dataset with macro f1 performance of 60.05{\%}, 44.85{\%}, and 70.64{\%} for clinical events, attributes, and relations, respectively."",",electronic health record,relation extract,annotat
" ""Proceedings of the The Sixth Workshop on Technologies for Machine Translation of Low-Resource Languages (LoResMT 2023)"","," ""entity standardization maps noisy mentions from free-form text to standard entities in a knowledge base. the unique challenge of this task relative to other entity-related tasks is the lack of surrounding context and numerous variations in the surface form of the mentions, especially when it comes to generalization across domains where labeled data is scarce. previous research mostly focuses on developing models either heavily relying on context, or dedicated solely to a specific domain. in contrast, we propose cosines, a generic and adaptable framework with contrastive siamese network for entity standardization that effectively adapts a pretrained language model to capture the syntax and semantics of the entities in a new domain. we construct a new dataset in the technology domain, which contains 640 technical stack entities and 6,412 mentions collected from industrial content management systems. we demonstrate that cosines yields higher accuracy and faster runtime than baselines derived from leading methods in this domain. cosines also achieves competitive performance in four standard datasets from the chemistry, medicine, and biomedical domains, demonstrating its cross-domain applicability. code and data is available at \url{https://github.com/konveyor/tackle-container-advisor/tree/main/entity_standardizer/cosines}"",",medical domain,semant,challeng
" ""An Investigation of Evaluation Methods in Automatic Medical Note Generation"","," ""recent studies on automatic note generation have shown that doctors can save significant amounts of time when using automatic clinical note generation (knoll et al., 2022). summarization models have been used for this task to generate clinical notes as summaries of doctor-patient conversations (krishna et al., 2021; cai et al., 2022). however, assessing which model would best serve clinicians in their daily practice is still a challenging task due to the large set of possible correct summaries, and the potential limitations of automatic evaluation metrics. in this paper we study evaluation methods and metrics for the automatic generation of clinical notes from medical conversation. in particular, we propose new task-specific metrics and we compare them to sota evaluation metrics in text summarization and generation, including: (i) knowledge-graph embedding-based metrics, (ii) customized model-based metrics with domain-specific weights, (iii) domain-adapted/fine-tuned metrics, and (iv) ensemble metrics. to study the correlation between the automatic metrics and manual judgments, we evaluate automatic notes/summaries by comparing the system and reference facts and computing the factual correctness, and the hallucination and omission rates for critical medical facts. this study relied on seven datasets manually annotated by domain experts. our experiments show that automatic evaluation metrics can have substantially different behaviors on different types of clinical notes datasets. however, the results highlight one stable subset of metrics as the most correlated with human judgments with a relevant aggregation of different evaluation criteria."",",clinical not,generat,annotat
" ""A Two-Stage Decoder for Efficient {ICD} Coding"","," ""clinical notes in healthcare facilities are tagged with the international classification of diseases (icd) code; a list of classification codes for medical diagnoses and procedures. icd coding is a challenging multilabel text classification problem due to noisy clinical document inputs and long-tailed label distribution. recent automated icd coding efforts improve performance by encoding medical notes and codes with additional data and knowledge bases. however, most of them do not reflect how human coders generate the code: first, the coders select general code categories and then look for specific subcategories that are relevant to a patient{'}s condition. inspired by this, we propose a two-stage decoding mechanism to predict icd codes. our model uses the hierarchical properties of the codes to split the prediction into two steps: at first, we predict the parent code and then predict the child code based on the previous prediction. experiments on the public mimic-iii data set have shown that our model performs well in single-model settings without external data or knowledge."",",clinical not,generat,challeng
" ""Efficient Document Embeddings via Self-Contrastive Bregman Divergence Learning"","," ""learning quality document embeddings is a fundamental problem in natural language processing (nlp), information retrieval (ir), recommendation systems, and search engines. despite recent advances in the development of transformer-based models that produce sentence embeddings with self-contrastive learning, the encoding of long documents (ks of words) is still challenging with respect to both efficiency and quality considerations. therefore, we train longfomer-based document encoders using a state-of-the-art unsupervised contrastive learning method (simcse). further on, we complement the baseline method -siamese neural network- with additional convex neural networks based on functional bregman divergence aiming to enhance the quality of the output document representations. we show that overall the combination of a self-contrastive siamese network and our proposed neural bregman network outperforms the baselines in two linear classification settings on three long document topic classification tasks from the legal and biomedical domains."",",medical domain,natural language process,challeng
" ""Focus-aware Response Generation in Inquiry Conversation"","," ""inquiry conversation is a common form of conversation that aims to complete the investigation (e.g., court hearing, medical consultation and police interrogation) during which a series of focus shifts occurs. while many models have been proposed to generate a smooth response to a given conversation history, neglecting the focus can limit performance in inquiry conversation where the order of the focuses plays there a key role. in this paper, we investigate the problem of response generation in inquiry conversation by taking the focus into consideration. we propose a novel focus-aware response generation (frg) method by jointly optimizing a multi-level encoder and a set of focal decoders to generate several candidate responses that correspond to different focuses. additionally, a focus ranking module is proposed to predict the next focus and rank the candidate responses. experiments on two orthogonal inquiry conversation datasets (judicial, medical domain) demonstrate that our method generates results significantly better in automatic metrics and human evaluation compared to the state-of-the-art approaches."",",medical domain,generat,evalu
" ""Quality Analysis of Multilingual Neural Machine Translation Systems and Reference Test Translations for the {E}nglish-{R}omanian language pair in the Medical Domain"","," ""multilingual neural machine translation (mnmt) models allow to translate across multiple languages based on only one system. we study the quality of a domain-adapted mnmt model in the medical domain for english-romanian with automatic metrics and a human error typology annotation based on the multidimensional quality metrics (mqm). we further expand the mqm typology to include terminology-specific error categories. we compare the out-of-domain mnmt with the in-domain adapted mnmt on a standard test dataset of abstracts from medical publications. the in-domain mnmt model outperforms the out-of-domain mnmt in all measured automatic metrics and produces fewer errors. in addition, we perform the manual annotation over the reference test dataset to study the quality of the reference translations. we identify a high number of omissions, additions, and mistranslations in the reference dataset, and comment on the assumed accuracy of existing datasets. finally, we compare the correlation between the comet, bertscore, and chrf automatic metrics with the mqm annotated translations. comet shows a better correlation with the mqm scores compared to the other metrics."",",medical domain,translat,annotat
" ""Development of pre-trained language models for clinical {NLP} in {S}panish"","," ""clinical natural language processing aims to tackle language and prediction tasks using text from medical practice, such as clinical notes, prescriptions, and discharge summaries. several approaches have been tried to deal with these tasks. since 2017, pre-trained language models (plms) have achieved state-of-the-art performance in many tasks. however, most works have been developed in english. this phd research proposal addresses the development of plms for clinical nlp in spanish. to carry out this study, we will build a clinical corpus big enough to implement a functional plm. we will test several plm architectures and evaluate them with language and prediction tasks. the novelty of this work lies in the use of only clinical text, while previous clinical plms have used a mix of general, biomedical, and clinical text."",",discharge summar,natural language process,evalu
" ""Patient Outcome and Zero-shot Diagnosis Prediction with Hypernetwork-guided Multitask Learning"","," ""multitask deep learning has been applied to patient outcome prediction from text, taking clinical notes as input and training deep neural networks with a joint loss function of multiple tasks. however, the joint training scheme of multitask learning suffers from inter-task interference, and diagnosis prediction among the multiple tasks has the generalizability issue due to rare diseases or unseen diagnoses. to solve these challenges, we propose a hypernetwork-based approach that generates task-conditioned parameters and coefficients of multitask prediction heads to learn task-specific prediction and balance the multitask learning. we also incorporate semantic task information to improve the generalizability of our task-conditioned multitask model. experiments on early and discharge notes extracted from the real-world mimic database show our method can achieve better performance on multitask patient outcome prediction than strong baselines in most cases. besides, our method can effectively handle the scenario with limited information and improve zero-shot prediction on unseen diagnosis categories."",",clinical not,generat,challeng
" ""Modelling Temporal Document Sequences for Clinical {ICD} Coding"","," ""past studies on the icd coding problem focus on predicting clinical codes primarily based on the discharge summary. this covers only a small fraction of the notes generated during each hospital stay and leaves potential for improving performance by analysing all the available clinical notes. we propose a hierarchical transformer architecture that uses text across the entire sequence of clinical notes in each hospital stay for icd coding, and incorporates embeddings for text metadata such as their position, time, and type of note. while using all clinical notes increases the quantity of data substantially, superconvergence can be used to reduce training costs. we evaluate the model on the mimic-iii dataset. our model exceeds the prior state-of-the-art when using only discharge summaries as input, and achieves further performance improvements when all clinical notes are used as input."",",discharge summar,generat,evalu
" ""{GLADIS}: A General and Large Acronym Disambiguation Benchmark"","," ""acronym disambiguation (ad) is crucial for natural language understanding on various sources, including biomedical reports, scientific papers, and search engine queries. however, existing acronym disambiguationbenchmarks and tools are limited to specific domains, and the size of prior benchmarks is rather small. to accelerate the research on acronym disambiguation, we construct a new benchmark with three components: (1) a much larger acronym dictionary with 1.5m acronyms and 6.4m long forms; (2) a pre-training corpus with 160 million sentences;(3) three datasets that cover thegeneral, scientific, and biomedical domains. we then pre-train a language model, \textit{acrobert}, on our constructed corpus for general acronym disambiguation, and show the challenges and values of our new benchmark."",",medical domain,natural languag,challeng
" ""An Empirical Study of Clinical Note Generation from Doctor-Patient Encounters"","," ""medical doctors spend on average 52 to 102 minutes per day writing clinical notes from their patient encounters (hripcsak et al., 2011). reducing this workload calls for relevant and efficient summarization methods. in this paper, we introduce new resources and empirical investigations for the automatic summarization of doctor-patient conversations in a clinical setting. in particular, we introduce the mts-dialog dataset; a new collection of 1,700 doctor-patient dialogues and corresponding clinical notes. we use this new dataset to investigate the feasibility of this task and the relevance of existing language models, data augmentation, and guided summarization techniques. we compare standard evaluation metrics based on n-gram matching, contextual embeddings, and fact extraction to assess the accuracy and the factual consistency of the generated summaries. to ground these results, we perform an expert-based evaluation using relevant natural language generation criteria and task-specific criteria such as critical omissions, and study the correlation between the automatic metrics and expert judgments. to the best of our knowledge, this study is the first attempt to introduce an open dataset of doctor-patient conversations and clinical notes, with detailed automated and manual evaluations of clinical note generation."",",clinical not,natural languag,evalu
" ""Enriching Biomedical Knowledge for Low-resource Language Through Large-scale Translation"","," ""biomedical data and benchmarks are highly valuable yet very limited in low-resource languages other than english, such as vietnamese. in this paper, we use a state-of-the-art translation model in english-vietnamese to translate and produce both pretrained and supervised data in the biomedical domains. thanks to such large-scale translation, we introduce vipubmedt5, a pretrained encoder-decoder transformer model trained on 20 million translated abstracts from the high-quality public pubmed corpus. vipubmedt5 demonstrates state-of-the-art results on two different biomedical benchmarks in summarization and acronym disambiguation. further, we release vimednli - a new nlp task in vietnamese translated from mednli using the recently public en-vi translation model and carefully refined by human experts, with evaluations of existing methods against vipubmedt5."",",medical domain,translat,benchmark
" ""{INCOGNITUS}: A Toolbox for Automated Clinical Notes Anonymization"","," ""automated text anonymization is a classical problem in natural language processing (nlp). the topic has evolved immensely throughout the years, with the first list-search and rule-based solutions evolving to statistical modeling approaches and later to advanced systems that rely on powerful state-of-the-art language models. even so, these solutions fail to be widely implemented in the most privacy-demanding areas of activity, such as healthcare; none of them is perfect, and most can not guarantee rigorous anonymization. this paper presents incognitus, a flexible platform for the automated anonymization of clinical notes that offers the possibility of applying different techniques. the available tools include an underexplored yet promising method that guarantees 100{\%} recall by replacing each word with a semantically identical one. in addition, the presented framework incorporates a performance evaluation module to compute a novel metric for information loss assessment in real-time."",",clinical not,natural language process,evalu
" ""Entity Coreference and Co-occurrence Aware Argument Mining from Biomedical Literature"","," ""biomedical argument mining (bam) aims at automatically identifying the argumentative structure in biomedical texts. however, identifying and classifying argumentative relations (ar) between argumentative components (ac) is challenging since it not only needs to understand the semantics of acs but also need to capture the interactions between them. we argue that entities can serve as bridges that connect different acs since entities and their mentions convey significant semantic information in biomedical argumentation. for example, it is common that related ac pairs share a common entity. capturing such entity information can be beneficial for the relation identification (ri) task. in order to incorporate this entity information into bam, we propose an entity coreference and co-occurrence aware argument mining (eccam) framework based on an edge-oriented graph model for bam. we evaluate our model on a benchmark dataset and from the experimental results we find that our method improves upon state-of-the-art methods."",",medical text,semant,challeng
" ""Medical Visual Textual Entailment for Numerical Understanding of Vision-and-Language Models"","," ""assessing the capacity of numerical understanding of vision-and-language models over images and texts is crucial for real vision-and-language applications, such as systems for automated medical image analysis. we provide a visual reasoning dataset focusing on numerical understanding in the medical domain. the experiments using our dataset show that current vision-and-language models fail to perform numerical inference in the medical domain. however, the data augmentation with only a small amount of our dataset improves the model performance, while maintaining the performance in the general domain."",",medical domain,infer,assess
" ""Investigating Massive Multilingual Pre-Trained Machine Translation Models for Clinical Domain via Transfer Learning"","," ""massively multilingual pre-trained language models (mmplms) are developed in recent years demonstrating superpowers and the pre-knowledge they acquire for downstream tasks. this work investigates whether mmplms can be applied to clinical domain machine translation (mt) towards entirely unseen languages via transfer learning. we carry out an experimental investigation using meta-ai{'}s mmplms {``}wmt21-dense-24-wide-en-x and x-en (wmt21fb){''} which were pre-trained on 7 language pairs and 14 translation directions including english to czech, german, hausa, icelandic, japanese, russian, and chinese, and the opposite direction. we fine-tune these mmplms towards english-\textit{spanish} language pair which \textit{did not exist at all} in their original pre-trained corpora both implicitly and explicitly.we prepare carefully aligned \textit{clinical} domain data for this fine-tuning, which is different from their original mixed domain knowledge.our experimental result shows that the fine-tuning is very successful using just 250k well-aligned in-domain en-es segments for three sub-task translation testings: clinical cases, clinical terms, and ontology concepts. it achieves very close evaluation scores to another mmplm nllb from meta-ai, which included spanish as a high-resource setting in the pre-training.to the best of our knowledge, this is the first work on using mmplms towards \textit{clinical domain transfer-learning nmt} successfully for totally unseen languages during pre-training."",",clinical domain,translat,evalu
" ""Context-aware Medication Event Extraction from Unstructured Text"","," ""accurately capturing medication history is crucial in delivering high-quality medical care. the extraction of medication events from unstructured clinical notes, however, is challenging because the information is presented in complex narratives. we address this challenge by leveraging the newly released contextualized medication event dataset (cmed) as part of our participation in the 2022 national nlp clinical challenges (n2c2) shared task. our study evaluates the performance of various pretrained language models in this task. further, we find that data augmentation coupled with domain-specific training provides notable improvements. with experiments, we also underscore the importance of careful data preprocessing in medical event detection."",",clinical not,nlp,shared task
