Tintle,Abstract,Matched Search Term 1,Matched Search Term 2,Matched Search Term 4
" ""Few-Shot Text Ranking with Meta Adapted Synthetic Weak Supervision"","," ""the effectiveness of neural information retrieval (neu-ir) often depends on a large scale of in-domain relevance training signals, which are not always available in real-world ranking scenarios. to democratize the benefits of neu-ir, this paper presents metaadaptrank, a domain adaptive learning method that generalizes neu-ir models from label-rich source domains to few-shot target domains. drawing on source-domain massive relevance supervision, metaadaptrank contrastively synthesizes a large number of weak supervision signals for target domains and meta-learns to reweight these synthetic {``}weak{''} data based on their benefits to the target-domain ranking accuracy of neu-ir models. experiments on three trec benchmarks in the web, news, and biomedical domains show that metaadaptrank significantly improves the few-shot ranking accuracy of neu-ir models. further analyses indicate that metaadaptrank thrives from both its contrastive weak data synthesis and meta-reweighted data selection. the code and data of this paper can be obtained from \url{https://github.com/thunlp/metaadaptrank}."",",medical domain,nlp,benchmark
" ""Cross-modal Memory Networks for Radiology Report Generation"","," ""medical imaging plays a significant role in clinical practice of medical diagnosis, where the text reports of the images are essential in understanding them and facilitating later treatments. by generating the reports automatically, it is beneficial to help lighten the burden of radiologists and significantly promote clinical automation, which already attracts much attention in applying artificial intelligence to medical domain. previous studies mainly follow the encoder-decoder paradigm and focus on the aspect of text generation, with few studies considering the importance of cross-modal mappings and explicitly exploit such mappings to facilitate radiology report generation. in this paper, we propose a cross-modal memory networks (cmn) to enhance the encoder-decoder framework for radiology report generation, where a shared memory is designed to record the alignment between images and texts so as to facilitate the interaction and generation across modalities. experimental results illustrate the effectiveness of our proposed model, where state-of-the-art performance is achieved on two widely used benchmark datasets, i.e., iu x-ray and mimic-cxr. further analyses also prove that our model is able to better align information from radiology images and texts so as to help generating more accurate reports in terms of clinical indicators."",",medical domain,generat,benchmark
" ""Joint Biomedical Entity and Relation Extraction with Knowledge-Enhanced Collective Inference"","," ""compared to the general news domain, information extraction (ie) from biomedical text requires much broader domain knowledge. however, many previous ie methods do not utilize any external knowledge during inference. due to the exponential growth of biomedical publications, models that do not go beyond their fixed set of parameters will likely fall behind. inspired by how humans look up relevant information to comprehend a scientific text, we present a novel framework that utilizes external knowledge for joint entity and relation extraction named keci (knowledge-enhanced collective inference). given an input text, keci first constructs an initial span graph representing its initial understanding of the text. it then uses an entity linker to form a knowledge graph containing relevant background knowledge for the the entity mentions in the text. to make the final predictions, keci fuses the initial span graph and the knowledge graph into a more refined graph using an attention mechanism. keci takes a collective approach to link mention spans to entities by integrating global relational information into local representations using graph convolutional networks. our experimental results show that the framework is highly effective, achieving new state-of-the-art results in two different benchmark datasets: biorelex (binding interaction detection) and ade (adverse drug event extraction). for example, keci achieves absolute improvements of 4.59{\%} and 4.91{\%} in f1 scores over the state-of-the-art on the biorelex entity and relation extraction tasks"",",medical text,infer,benchmark
" ""Elhuyar submission to the Biomedical Translation Task 2020 on terminology and abstracts translation"","," ""this article describes the systems submitted by elhuyar to the 2020 biomedical translation shared task, specifically the systems presented in the subtasks of terminology translation for english-basque and abstract translation for english-basque and english-spanish. in all cases a transformer architecture was chosen and we studied different strategies to combine open domain data with biomedical domain data for building the training corpora. for the english-basque pair, given the scarcity of parallel corpora in the biomedical domain, we set out to create domain training data in a synthetic way. the systems presented in the terminology and abstract translation subtasks for the english-basque language pair ranked first in their respective tasks among four participants, achieving 0.78 accuracy for terminology translation and a bleu of 0.1279 for the translation of abstracts. in the abstract translation task for the english-spanish pair our team ranked second (bleu",medical domain,translat,shared task
" ""Ixamed{'}s submission description for {WMT}20 Biomedical shared task: benefits and limitations of using terminologies for domain adaptation"","," ""in this paper we describe the systems developed at ixa for our participation in wmt20 biomedical shared task in three language pairs, en-eu, en-es and es-en. when defining our approach, we have put the focus on making an efficient use of corpora recently compiled for training machine translation (mt) systems to translate covid-19 related text, as well as reusing previously compiled corpora and developed systems for biomedical or clinical domain. regarding the techniques used, we base on the findings from our previous works for translating clinical texts into basque, making use of clinical terminology for adapting the mt systems to the clinical domain. however, after manually inspecting some of the outputs generated by our systems, for most of the submissions we end up using the system trained only with the basic corpus, since the systems including the clinical terminologies generated outputs shorter in length than the corresponding references. thus, we present simple baselines for translating abstracts between english and spanish (en/es); while for translating abstracts and terms from english into basque (en-eu), we concatenate the best en-es system for each kind of text with our es-eu system. we present automatic evaluation results in terms of bleu scores, and analyse the effect of including clinical terminology on the average sentence length of the generated outputs. following the recent recommendations for a responsible use of gpus for nlp research, we include an estimation of the generated co2 emissions, based on the power consumed for training the mt systems."",",clinical domain,translat,shared task
" ""Improving Medical {NLI} Using Context-Aware Domain Knowledge"","," ""domain knowledge is important to understand both the lexical and relational associations of words in natural language text, especially for domain-specific tasks like natural language inference (nli) in the medical domain, where due to the lack of a large annotated dataset such knowledge cannot be implicitly learned during training. however, because of the linguistic idiosyncrasies of clinical texts (e.g., shorthand jargon), solely relying on domain knowledge from an external knowledge base (e.g., umls) can lead to wrong inference predictions as it disregards contextual information and, hence, does not return the most relevant mapping. to remedy this, we devise a knowledge adaptive approach for medical nli that encodes the premise/hypothesis texts by leveraging supplementary external knowledge, alongside the umls, based on the word contexts. by incorporating refined domain knowledge at both the lexical and relational levels through a multi-source attention mechanism, it is able to align the token-level interactions between the premise and hypothesis more effectively. comprehensive experiments and case study on the recently released mednli dataset are conducted to validate the effectiveness of the proposed approach."",",medical domain,natural languag,annotat
" ""On the effectiveness of small, discriminatively pre-trained language representation models for biomedical text mining"","," ""neural language representation models such as bert have recently shown state of the art performance in downstream nlp tasks and bio-medical domain adaptation of bert (bio-bert) has shown same behavior on biomedical text mining tasks. however, due to their large model size and resulting increased computational need, practical application of models such as bert is challenging making smaller models with comparable performance desirable for real word applications. recently, a new language transformers based language representation model named electra is introduced, that makes efficient usage of training data in a generative-discriminative neural model setting that shows performance gains over bert. these gains are especially impressive for smaller models. here, we introduce two small electra based model named bio-electra and bio-electra++ that are eight times smaller than bert base and bio-bert and achieves comparable or better performance on biomedical question answering, yes/no question answer classification, question answer candidate ranking and relation extraction tasks. bio-electra is pre-trained from scratch on pubmed abstracts using a consumer grade gpu with only 8gb memory. bio-electra++ is the further pre-trained version of bio-electra trained on a corpus of open access full papers from pubmed central. while, for biomedical named entity recognition, large bert base model outperforms bio-electra++, bio-electra and electra-small++, with hyperparameter tuning bio-electra++ achieves results comparable to bert."",",medical domain,nlp,challeng
" ""{C}omp{L}ex {---} A New Corpus for Lexical Complexity Prediction from {L}ikert {S}cale Data"","," ""predicting which words are considered hard to understand for a given target population is a vital step in many nlp applications such astext simplification. this task is commonly referred to as complex word identification (cwi). with a few exceptions, previous studieshave approached the task as a binary classification task in which systems predict a complexity value (complex vs. non-complex) fora set of target words in a text. this choice is motivated by the fact that all cwi datasets compiled so far have been annotated using abinary annotation scheme. our paper addresses this limitation by presenting the first english dataset for continuous lexical complexityprediction. we use a 5-point likert scale scheme to annotate complex words in texts from three sources/domains: the bible, europarl,and biomedical texts. this resulted in a corpus of 9,476 sentences each annotated by around 7 annotators."",",medical text,nlp,annotat
" ""Robust Prediction of Punctuation and Truecasing for Medical {ASR}"","," ""automatic speech recognition (asr) systems in the medical domain that focus on transcribing clinical dictations and doctor-patient conversations often pose many challenges due to the complexity of the domain. asr output typically undergoes automatic punctuation to enable users to speak naturally, without having to vocalize awkward and explicit punctuation commands, such as {``}period{''}, {``}add comma{''} or {``}exclamation point{''}, while truecasing enhances user readability and improves the performance of downstream nlp tasks. this paper proposes a conditional joint modeling framework for prediction of punctuation and truecasing using pretrained masked language models such as bert, biobert and roberta. we also present techniques for domain and task specific adaptation by fine-tuning masked language models with medical domain data. finally, we improve the robustness of the model against common errors made in asr by performing data augmentation. experiments performed on dictation and conversational style corpora show that our proposed model achieves 5{\%} absolute improvement on ground truth text and 10{\%} improvement on asr outputs over baseline models under f1 metric."",",medical domain,nlp,challeng
" ""Answering Questions on {COVID}-19 in Real-Time"","," ""the recent outbreak of the novel coronavirus is wreaking havoc on the world and researchers are struggling to effectively combat it. one reason why the fight is difficult is due to the lack of information and knowledge. in this work, we outline our effort to contribute to shrinking this knowledge vacuum by creating covidask, a question answering (qa) system that combines biomedical text mining and qa techniques to provide answers to questions in real-time. our system also leverages information retrieval (ir) approaches to provide entity-level answers that are complementary to qa models. evaluation of covidask is carried out by using a manually created dataset called covid-19 questions which is based on information from various sources, including the cdc and the who. we hope our system will be able to aid researchers in their search for knowledge and information not only for covid-19, but for future pandemics as well."",",medical text,information retriev,evalu
" ""A Multilingual Neural Machine Translation Model for Biomedical Data"","," ""we release a multilingual neural machine translation model, which can be used to translate text in the biomedical domain. the model can translate from 5 languages (french, german, italian, korean and spanish) into english. it is trained with large amounts of generic and biomedical data, using domain tags. our benchmarks show that it performs near state-of-the-art both on news (generic domain) and biomedical test sets, and that it outperforms the existing publicly released models. we believe that this release will help the large-scale multilingual analysis of the digital content of the covid-19 crisis and of its effects on society, economy, and healthcare policies. we also release a test set of biomedical text for korean-english. it consists of 758 sentences from official guidelines and recent papers, all about covid-19."",",medical domain,translat,benchmark
" ""Localising the Clinical Terminology {SNOMED} {CT} by Semi-automated Creation of a {G}erman Interface Vocabulary"","," ""medical language exhibits great variations regarding users, institutions and language registers. with large parts of clinical documents in free text, nlp is playing a more and more important role in unlocking re-usable and interoperable meaning from medical records. this study describes the architectural principles and the evolution of a german interface vocabulary, combining machine translation with human annotation and rule-based term generation, yielding a resource with 7.7 million raw entries, each of which linked to the reference terminology snomed ct, an international standard with about 350 thousand concepts. the purpose is to offer a high coverage of medical jargon in order to optimise terminology grounding of clinical texts by text mining systems. the core resource is a manually curated table of english-to-german word and chunk translations, supported by a set of language generation rules. the work describes a workflow consisting the enrichment and modification of this table with human and machine efforts, manually enriched by grammarspecific tags. top-down and bottom-up methods for terminology population used in parallel. the final interface terms are produced by a term generator, which creates one-to-many german variants per snomed ct english description. filtering against a large collection of domain terminologies and corpora drastically reduces the size of the vocabulary in favour of more realistic terms or terms that can reasonably be expected to match clinical text passages within a text-mining pipeline. an evaluation was performed by a comparison between the current version of the german interface vocabulary and the english description table of the snomed ct international release. an exact term matching was performed with a small parallel corpus constituted by text snippets from different clinical documents. with overall low retrieval parameters (with f-values around 30{\%}), the performance of the german language scenario reaches 80 {--} 90{\%} of the english one. interestingly, annotations are slightly better with machine-translated (german {--} english) texts, using the international snomed ct resource only."",",medical record,translat,annotat
" ""Transfer learning applied to text classification in {S}panish radiological reports"","," ""pre-trained text encoders have rapidly advanced the state-of-the-art on many natural language processing tasks. this paper presents the use of transfer learning methods applied to the automatic detection of codes in radiological reports in spanish. assigning codes to a clinical document is a popular task in nlp and in the biomedical domain. these codes can be of two types: standard classifications (e.g. icd-10) or specific to each clinic or hospital. in this study we show a system using specific radiology clinic codes. the dataset is composed of 208,167 radiology reports labeled with 89 different codes. the corpus has been evaluated with three methods using the bert model applied to spanish: multilingual bert, beto and xlm. the results are interesting obtaining 70{\%} of f1-score with a pre-trained multilingual model."",",medical domain,natural language process,evalu
" ""Alignment Annotation for Clinic Visit Dialogue to Clinical Note Sentence Language Generation"","," ""for every patient{'}s visit to a clinician, a clinical note is generated documenting their medical conversation, including complaints discussed, treatments, and medical plans. despite advances in natural language processing, automating clinical note generation from a clinic visit conversation is a largely unexplored area of research. due to the idiosyncrasies of the task, traditional methods of corpus creation are not effective enough approaches for this problem. in this paper, we present an annotation methodology that is content- and technique- agnostic while associating note sentences to sets of dialogue sentences. the sets can further be grouped with higher order tags to mark sets with related information. this direct linkage from input to output decouples the annotation from specific language understanding or generation strategies. here we provide data statistics and qualitative analysis describing the unique annotation challenges. given enough annotated data, such a resource would support multiple modeling methods including information extraction with template language generation, information retrieval type language generation, or sequence to sequence modeling."",",clinical not,natural language process,annotat
" ""{PATE}: A Corpus of Temporal Expressions for the In-car Voice Assistant Domain"","," ""the recognition and automatic annotation of temporal expressions (e.g. {``}add an event for tomorrow evening at eight to my calendar{''}) is a key module for ai voice assistants, in order to allow them to interact with apps (for example, a calendar app). however, in the nlp literature, research on temporal expressions has focused mostly on data from the news, from the clinical domain, and from social media. the voice assistant domain is very different than the typical domains that have been the focus of work on temporal expression identification, thus requiring a dedicated data collection. we present a crowdsourcing method for eliciting natural-language commands containing temporal expressions for an ai voice assistant, by using pictures and scenario descriptions. we annotated the elicited commands (480) as well as the commands in the snips dataset following the timeml/timex3 annotation guidelines, reaching a total of 1188 annotated commands. the commands can be later used to train the nlu components of an ai voice assistant."",",clinical domain,nlp,annotat
" ""A Corpus for Detecting High-Context Medical Conditions in Intensive Care Patient Notes Focusing on Frequently Readmitted Patients"","," ""a crucial step within secondary analysis of electronic health records (ehrs) is to identify the patient cohort under investigation. while ehrs contain medical billing codes that aim to represent the conditions and treatments patients may have, much of the information is only present in the patient notes. therefore, it is critical to develop robust algorithms to infer patients{'} conditions and treatments from their written notes. in this paper, we introduce a dataset for patient phenotyping, a task that is defined as the identification of whether a patient has a given medical condition (also referred to as clinical indication or phenotype) based on their patient note. nursing progress notes and discharge summaries from the intensive care unit of a large tertiary care hospital were manually annotated for the presence of several high-context phenotypes relevant to treatment and risk of re-hospitalization. this dataset contains 1102 discharge summaries and 1000 nursing progress notes. each discharge summary and progress note has been annotated by at least two expert human annotators (one clinical researcher and one resident physician). annotated phenotypes include treatment non-adherence, chronic pain, advanced/metastatic cancer, as well as 10 other phenotypes. this dataset can be utilized for academic and industrial research in medicine and computer science, particularly within the field of medical natural language processing."",",electronic health record,natural language process,annotat
" ""The Medical Scribe: Corpus Development and Model Performance Analyses"","," ""there is a growing interest in creating tools to assist in clinical note generation using the audio of provider-patient encounters. motivated by this goal and with the help of providers and medical scribes, we developed an annotation scheme to extract relevant clinical concepts. we used this annotation scheme to label a corpus of about 6k clinical encounters. this was used to train a state-of-the-art tagging model. we report ontologies, labeling results, model performances, and detailed analyses of the results. our results show that the entities related to medications can be extracted with a relatively high accuracy of 0.90 f-score, followed by symptoms at 0.72 f-score, and conditions at 0.57 f-score. in our task, we not only identify where the symptoms are mentioned but also map them to canonical forms as they appear in the clinical notes. of the different types of errors, in about 19-38{\%} of the cases, we find that the model output was correct, and about 17-32{\%} of the errors do not impact the clinical note. taken together, the models developed in this work are more useful than the f-scores reflect, making it a promising approach for practical applications."",",clinical not,generat,annotat
" ""Towards a Versatile Medical-Annotation Guideline Feasible Without Heavy Medical Knowledge: Starting From Critical Lung Diseases"","," ""applying natural language processing (nlp) to medical and clinical texts can bring important social benefits by mining valuable information from unstructured text. a popular application for that purpose is named entity recognition (ner), but the annotation policies of existing clinical corpora have not been standardized across clinical texts of different types. this paper presents an annotation guideline aimed at covering medical documents of various types such as radiography interpretation reports and medical records. furthermore, the annotation was designed to avoid burdensome requirements related to medical knowledge, thereby enabling corpus development without medical specialists. to achieve these design features, we specifically focus on critical lung diseases to stabilize linguistic patterns in corpora. after annotating around 1100 electronic medical records following the annotation scheme, we demonstrated its feasibility using an ner task. results suggest that our guideline is applicable to large-scale clinical nlp projects."",",medical record,natural language process,annotat
" ""Is Language Modeling Enough? Evaluating Effective Embedding Combinations"","," ""universal embeddings, such as bert or elmo, are useful for a broad set of natural language processing tasks like text classification or sentiment analysis. moreover, specialized embeddings also exist for tasks like topic modeling or named entity disambiguation. we study if we can complement these universal embeddings with specialized embeddings. we conduct an in-depth evaluation of nine well known natural language understanding tasks with senteval. also, we extend senteval with two additional tasks to the medical domain. we present pubmedsection, a novel topic classification dataset focussed on the biomedical domain. our comprehensive analysis covers 11 tasks and combinations of six embeddings. we report that combined embeddings outperform state of the art universal embeddings without any embedding fine-tuning. we observe that adding topic model based embeddings helps for most tasks and that differing pre-training tasks encode complementary features. moreover, we present new state of the art results on the mpqa and subj tasks in senteval."",",medical domain,natural language process,evalu
